0,1
promocao moto e4 plus 5.5 16gb top,motorola moto e4 plus 3+16gb
promocao samsung galaxy s6 edge 64gb g925 vitrine,samsung galaxy s6 edge g925 32gb camera 16mp tela 5.1
promocao xiaomi mi note 5 64gb 4gb android note5,xiaomi mi note 7 tela infinita 6.3 pol ram 4gb 64gb camera dupla 48/5mp
pulseira bracelete cabo dados iphone 5 5s 5c 6 6 plus,iphone 5c apple 8gb usado
samsung a510 galaxy a5 2016 anatel nf 16gb i vitrine,usado samsung galaxy a5 2016
samsung g935 galaxy s7 edge 32gb 4g original i vitrine,galaxy s7 edge samsung 32gb
samsung galaxy a7 2017 a720f 32gb.7 4g 16mp 3gb+ nota,galaxy a7 samsung 2017 32gb dual a720f/ds
samsung galaxy grand prime+ plus lacrado 4g melhor j2 j3 j5,samsung galaxy grand prime
samsung galaxy j5 prime 32gb nota fiscal,samsung galaxy j5 prime usado
samsung galaxy j5 prime leitor digital anatel g570m,galaxy j5 prime samsung g570m/ds duos 32gb
samsung galaxy j7 prime 2 tv,samsung galaxy j7 prime
samsung galaxy j7 prime 32gb original usado,samsung galaxy j7 prime usado
samsung galaxy j7 prime g610f 32gb octa-core nota fiscal,galaxy j7 prime dual samsung g610f/ds 16gb
samsung galaxy k zoom c115 20mp 4g wifi tela demonstracao,"samsung galaxy j7 dual tela 5.5,4g/wifi,13mp,16gb-"
samsung galaxy pocket 2 duos g110 android 3g novo,samsung galaxy pocket 2 g110 camera 2mp android 4.4 dual chip bivolt bivolt
samsung galaxy pocket 2 duos g110 android 3g vitrine,samsung galaxy pocket 2 g110 camera 2mp android 4.4 dual chip bivolt bivolt
samsung galaxy pocket plus s5301 android 4.0 vitrine,samsung galaxy pocket s5301 4gb wi-fi gps 3g android 2.3
samsung galaxy s3 gt i9300 16gb siii 8mp 3g vitrine,samsung galaxy siii gt-i9300
samsung galaxy s5 16gb 4g g900m,galaxy s5 samsung g900m 16gb usado
samsung galaxy s5 g900m 16gb 4g,galaxy s5 samsung g900m 16gb usado
samsung galaxy s5 duos 4g sm g900md original nfe,usado galaxy s5 g900md 4g 16gb
samsung galaxy s5 g900 original 16gb semi novo,samsung galaxy s5 g900
samsung galaxy s5 g900m 16gb original usado mancha tela,galaxy s5 samsung g900m 16gb usado
samsung galaxy s5 mini duos g800 16gb dual chip vitrine,samsung galaxy s5 mini duos g800 -sm-g800hzwqzto
samsung galaxy s5 original g900m original,galaxy s5 samsung g900m 16gb usado
samsung galaxy s8 5.8in 64gb camera 12mp+8mp,samsung galaxy s8 64gb
samsung galaxy s8 64gb duos original novo vitrine g950fd,galaxy s8 duos 4g 64gb g950fd usado
samsung galaxy s9 128gb 5.8 2.8ghz 12mp lacrado anatel +nfe,samsung galaxy s9 dual chip android 8.0 tela 5.8 '' octa-core 2.8ghz 128gb 4g camera 12mp
samsung galaxy s9 128gb sm-g9600/ds anatel lacrado,usado samsung galaxy s9 g9600/ds 128gb
samsung galaxy s9 plus 128gb 6gb ram nacional nf,samsung galaxy s9 plus 128gb usado
"samsung galaxy s9 tela 5,8 128gb 12mp original anatel nf",samsung galaxy s9 dual 128gb 5.8 '' 12mp
samsung galaxy s9+,usado samsung galaxy s9 128gb
samsung galaxy s9+ plus 128gb lacrado nacional,samsung galaxy s9 plus 128gb usado
samsung galaxy s9+ s9 plus anatel 128gb lacrado nf garantia,samsung galaxy s9 plus 128gb usado
samsung j810m galaxy j8 64gb,samsung j8 j810m tela 6 dual sim 64gb
suporte veicular 360deguniversal s/es/gps4.3,carregador veicular fio inducao suporte magnetico
suporte veicular universal volante,carregador veicular fio inducao suporte magnetico
suporte veicular volante carro gps iphone / / / / unico unico unico unico,carregador veicular fio inducao suporte magnetico
"tablet samsung galaxy tab 4g sm-p355m,8,16gb camera 5mp android 5.0 quad core 1.2 ghz",tablet samsung tab 10.1 '' full hd 16gb wifi 8mp android 6
"xiaomi mi 8 64gb 6gb dual tela 6,2 snapdragon 845 rom global",mi 9 64gb dual sim versao global 6gb ram
xiaomi mi a1 5x dual chip 64gb 4gb ram 4g,xiaomi mi 8 lite 6.26 pol ram 4gb 64gb 4g dual chip camera dupla 12/5mp
"xiaomi mi a2 128gb 6gb 20mp tela 5,99 snapdragon 660 android",xiaomi mi 8 lite 6.26 pol ram 6gb 128gb 4g dual chip camera dupla 12/5mp
"xiaomi mi a2 32gb 4gb 20mp tela 5,99 snapdragon 660 android",xiaomi mi 8 lite versao global
"xiaomi mi a2 64gb 4gb 20mp tela 5,99 snapdragon 660 android",xiaomi mi 8 lite versao global--64gb
xiaomi mi a2 global 4gb ram 64gb 20mp snapdragon 660 android,xiaomi mi 8 lite versao global--64gb
"xiaomi mi a2 lite 32gb 3gb dual chip tela 5,84 rom global",xiaomi mi 8 lite versao global
"xiaomi mi a2 lite 64gb 4gb dual chip tela 5,84 rom global",xiaomi mi 8 lite versao global--64gb
xiaomi mi a2 lite 64gb 4gb dual chip tela 5.84 rom global,xiaomi mi 8 lite versao global--64gb
xiaomi mi a2 lite 64gb/4gb ram v. global juros,xiaomi mi 8 lite versao global--64gb
xiaomi mi mix 2s global 64gb pronta entrega,xiaomi mi 8 lite versao global--64gb
"xiaomi mi 5 plus 32gb 3gb dual chip rom global tela 5,99",xiaomi mi 8 lite versao global
"xiaomi mi 5 plus 64gb 4gb dual chip rom global tela 5,99",xiaomi mi 8 lite versao global--64gb
"xiaomi mi 6 64gb 4g 4gb ram tela 5,45 android 8.1",xiaomi mi 8 lite 6.26 pol ram 4gb 64gb 4g dual chip camera dupla 12/5mp
xiaomi mi note 5 64gb 4gb ram v. global,xiaomi mi 8 lite versao global--64gb
xiaomi mi note 5 64gb dual global combo nota fiscal,xiaomi mi 8 lite versao global--64gb
zenfone 4 selfie asus 4g 64gb 4gb 20+8 mp zd553kl,asus zenfone 4 selfie zd553kl dual sim 64gb 5.5 16mp-20+8mp
