0,1
samsung galaxy s9+ dual chip android 8.0 tela 6.2 '' octa-core 2.8ghz 128gb 4g camera 12mp dual cam ultraa,samsung galaxy s9+ dual chip android 8.0 tela 6.2 '' octa-core 2.8ghz 128gb 4g camera 12mp dual cam ultraa
samsung galaxy win 2 duos tv dual chip tela 4.5 '' tv digital android 4.4 cam 5mp processador quad core de1.2 ghz,samsung galaxy win 2 duos dual chip android 4.4 tela 4.5 '' 8gb 4g camera 5mp tv digital
samsung galaxy win 2 duos tv g360bt dual chip tela 4.5 '' tv digital android 4.4 cam 5mp processador quad core 1.2ghz,samsung galaxy win 2 duos dual chip android 4.4 tela 4.5 '' 8gb 4g camera 5mp tv digital
samsung galaxy win 2 duos tv g360bt dual chip tela 4.5 '' tv digital android 4.4 cam 5mp processador quad core 1.2 ghz,samsung galaxy win 2 duos dual chip android 4.4 tela 4.5 '' 8gb 4g camera 5mp tv digital
samsung galaxy young 2 duos g130m tela 3.5 '' dual chip android 4.4 3g wi-fi gps radio fm camera 3mp,samsung galaxy young 2 duos g130m tela 3.5 '' dual chip android 4.4 3g wi-fi
samsung galaxy young 2 duos g130m tela 3.5 '' dual chip android 4.4 3g wi-fi gps radio fm camera 3mp,samsung galaxy young 2 duos g130m tela 3.5 '' dual chip android 4.4 3g wi-fi
sony xperia xa1 g3116 32gb tela 5 '' hd dual chip camera 23mp 4g android 7.0 processador octa-core 3gb ram,sony xperia xa1 g3116 tela 5 '' 32gb 23mp
"sony xperia xa1 plus g3426 32gb tela 5,5 '' dual chip camera 23mp 4g android 7.0 processador octa-core 4gb ram",sony xperia xa1 5 '' camera 23mp 32gb octa core 3gb ram
"sony xperia xa1 plus g3426 32gb tela 5,5 '' dual chip camera 23mp 4g android 7.0 processador octa-core 4gb ram",sony xperia xa1 5 '' camera 23mp 32gb octa core 3gb ram
sony xperia xa1 ultra g3223 32gb 1sim,sony xperia xa1 ultra g3223 4gb/32gb lte 1sim 6.0 '' cam.23mp+16mp-
"sony xperia xz1 g8341 64gb tela 5,2 '' single chip camera 19mp 4g android 8.0 processador octa-core 4gb ram",sony g8341 xperia xz1 single chip android tela 5.2 '' octa-core 64gb 4g camera 13mp
"sony xperia xz1 g8341 64gb tela 5,2 '' single chip camera 19mp 4g android 8.0 processador octa-core 4gb ram",sony g8341 xperia xz1 single chip android tela 5.2 '' octa-core 64gb 4g camera 13mp
"sony xperia xz1 g8341 64gb tela 5,2 '' single chip camera 19mp 4g android 8.0 processador octa-core 4gb ram",sony g8341 xperia xz1 single chip android tela 5.2 '' octa-core 64gb 4g camera 13mp
xiaomi mi 8 64gb/6gb dual sim global p/ entrega,mi 9 64gb dual sim versao global 6gb ram
xiaomi mi 8 64gb/6gb dual sim global p/ entrega,mi 9 64gb dual sim versao global 6gb ram
xiaomi mi 8 dualchip 128gb/6gb versao global,xiaomi mi 8 lite versao global
xiaomi mi a2 4gb/64gb dual sim tela 5.99 '' global,xiaomi mi 8 lite versao global--64gb
xiaomi mi a2 4gb/64gb dual sim tela 5.99 '' global,xiaomi mi 8 lite versao global--64gb
xiaomi mi a2 4gb/64gb dual sim tela 5.99 '' global,xiaomi mi 8 lite versao global--64gb
xiaomi mi a2 64gb dualsim 4gb 5.99 versao global,xiaomi mi 8 lite versao global--64gb
xiaomi mi a2 dual sim 32g 5.99 ver cores,xiaomi mi 8 lite versao global
xiaomi mi a2 dual sim 32g 5.99 ver cores,xiaomi mi 8 lite versao global
xiaomi mi a2 dualsim 4gb/32gb 5.99 versao global,xiaomi mi 8 lite versao global
xiaomi mi a2 dualsim 4gb/32gb 5.99 versao global,xiaomi mi 8 lite versao global
"xiaomi mi a2 lite 4gb ram 64gb 4000mah 4g 5,84",xiaomi mi 8 lite 6.26 pol ram 4gb 64gb 4g dual chip camera dupla 12/5mp
xiaomi mi a2 lite 64gb mem 4gb ram 4g,xiaomi mi 8 lite 6.26 pol ram 4gb 64gb 4g dual chip camera dupla 12/5mp
xiaomi mi a2 lite global 3gb ram 32gb p/ entrega,xiaomi mi 8 lite versao global
xiaomi mi a2 lite global 3gb ram 32gb p/ entrega,xiaomi mi 8 lite versao global
xiaomi mi a2 lite global 3gb ram 32gb p/ entrega,xiaomi mi 8 lite versao global
xiaomi mi a2 lite global 3gb ram 32gb p/ entrega,xiaomi mi 8 lite versao global
xiaomi mi a2 lite global 4gb ram 64gb p/ entrega,xiaomi mi 8 lite versao global--64gb
xiaomi mi mix 2s dual sim 64gb-5.99 12mp,xiaomi mi 8 lite versao global--64gb
xiaomi mi mi a2 lite 64gb dual 4gb ram global,xiaomi mi 8 lite versao global--64gb
xiaomi mi note 4 32gb 3gb ram dual chip global,xiaomi mi 8 lite versao global
xiaomi mi note 4x 64gb 4gb rom global,xiaomi mi 8 lite versao global--64gb
xiaomi mi note 5 32gb 3gb original,xiaomi mi 7 tela infinita 6.26 pol ram 3gb 32gb camera dupla 12/2mp
xiaomi mi note 5 32gb mem 3gb ram dual 5.99pol,motorola moto g6 32gb mem 3gb ram 2 chip 4g
xiaomi mi note 5 64gb 4gb ram 4g tela 5.99,xiaomi mi note 6 pro 6.26 pol ram 4gb 64gb 4g dual chip camera dupla 12/5mp
xiaomi mi note 5 64gb mem 4gb ram dual 5.99pol,xiaomi mi note 6 pro 6.26 pol ram 4gb 64gb 4g dual chip camera dupla 12/5mp
xiaomi mi note 5 64gb mem 4gb ram dual 5.99pol,xiaomi mi note 6 pro 6.26 pol ram 4gb 64gb 4g dual chip camera dupla 12/5mp
apple iphone 5s 16gb 4g 100 original promocao envio ja,iphone 5s apple 16gb
apple iphone 6 64gb novo lacrado nota fiscal,apple iphone 6 32gb novo lacrado
apple iphone 6 64gb rfb lacrado oferta imperdivel confira,apple iphone 6 32gb novo lacrado
apple iphone 7 128gb original 4g nacional 12mpx ios| vitrine,iphone 32gb nacional
apple iphone 7 plus 256gb lacrado garantia ano +2 brindes,apple iphone 6s 16gb lacrado garantia 2 anos
apple iphone 8 64gb lacrado anatel,asus zenfone 2 lacrado anatel 64gb 4gb ram
apple iphone 8 64gb lacrado original,apple iphone 6 32gb novo lacrado
apple iphone 8 64gb vitrine garantia 3 meses promocao,iphone apple 64gb
apple iphone 8 plus 256gb lacrado 1 ano garantia,apple iphone 6s 16gb lacrado garantia 2 anos
apple iphone 8 plus 64gb anatel,iphone 6 plus 64gb apple
apple iphone 8 plus 64gb anatel 4g 1 ano garantia nf,motorola moto g3 xt1543 16gb novo nacional anatel nf
apple iphone 8 plus 64gb novo lacrado,apple iphone 6 32gb novo lacrado
apple iphone 8 plus 64gb lacrado nota fiscal,apple iphone 6 32gb novo lacrado
apple iphone 8 plus 64gb novo lacrado 1 ano garantia +nf,apple iphone 6s 16gb novo lacrado 2 anos garantia
apple iphone 8 plus 64gb novo lacrado 1 ano garantia anatel,apple iphone 6s 16gb novo lacrado 2 anos garantia
apple iphone x 64gb anatel lacrado,asus zenfone 2 lacrado anatel 64gb 4gb ram
apple iphone x 64gb anatel lacrado,asus zenfone 2 lacrado anatel 64gb 4gb ram
bracadeira esportiva galaxy grand duos s6 s4 s4 s s ate 14 cm x 8 cm preta,usado galaxy s4 mini duos 8gb
"bracadeira esportiva iphone 4 4s 5 5s 5c ate 12,5 x 6 cm preta",iphone 4s 8gb
bracadeira esportiva iphone 6 ate 14 x 8 cm preta,lg k10 m250ev dual chip android 6.0 tela 5.3 octa core 1.14 ghz 16gb 4g camera 13mp
bracadeira samsung galaxy a3,samsung galaxy a3 duos
bracadeira samsung galaxy alpha,samsung galaxy alpha android 4.4 tela 4.7 '' 32gb 4g camera 12mp
bracadeira samsung galaxy s4 mini,usado galaxy s4 mini duos 8gb
bracadeira samsung galaxy s5 mini,usado galaxy s5 mini duos samsung 16gb
bumber samsung galaxy note 2,galaxy note 5 samsung
cabo dados colorido micro usb samsung lg nokia motorola v8,cabo micro usb multilaser wi298 samsung motorola colors
galaxy s9 plus 128 gb,iphone 6s plus 128 gb
lg k4 android barato 2017 whats original,lg k4 4g
moto e4 plus 5.5 16gb biometria dual sim,motorola moto e4 plus 3+16gb
moto e4 plus 5.5 16gb biometria dual sim,motorola moto e4 plus 3+16gb
motorola moto c xt1750 8gb dual chip,motorola moto c 8gb xt1750
motorola moto z2 play 64gb xt1710-08,usado moto z2 play motorola xt1710 dual 64gb
motorola moto z3 play tela 6,usado motorola moto z3 play 64gb
motorola moto z3 play tela 6,usado motorola moto z3 play 64gb
samsung galaxy s9+ tela 6.2 128gb,usado samsung galaxy s9 128gb
samsung galaxy s9+ 128gb,usado samsung galaxy s9 128gb
tp-link neffos c5l 4g lte 4.5 '' 8gb,tp link neffos y5
xiaomi mi 5 plus 32gb novo,xiaomi mi 8 lite versao global
alcatel pixi 4 5010e lite dual chip tv digital tela 5 '' 8gb camera 8mp frontal 8mp c,alcatel pixi 4 colors 5 '' 5010e / camera 8mp tela 5 '' cartao microsd 8gb
barato original motorola g5 s 32gb envio24h 4 gb ram,motorola moto g g5 s plus 32gb original
blu samba jr q53 dual chip,blu win jr dual chip camera vga dual core
caterpillar cat s60 32gb cam termica 4g original,cat s60 dualsim 4g 3g ram 32gb
caterpillar cat s60 dual chip 32gb 4g 100 original,cat s60 dualsim 4g 3g ram 32gb
caterpillar cat s60 dual chip 32gb 4g original c/ nf,cat s60 dualsim 4g 3g ram 32gb
galaxy j2 prime 4g samsung 8gb original,samsung j2 prime 8gb dual chip
galaxy j7 neo tv tela 5.5 android brinde,samsung galaxy j7 neo dual chip android 7.0 tela 5.5 '' 16gb 4g camera 13mp tv
galaxy j7 pro 64gb cartao sd 8gb gratis,motorola moto g6 64gb tela 5.7 '' cartao sd 16gb
galaxy j7 pro 64gb cartao sd 8gb gratis,motorola moto g6 64gb tela 5.7 '' cartao sd 16gb
galaxy j7 pro 64gb cartao sd 8gb gratis,motorola moto g6 64gb tela 5.7 '' cartao sd 16gb
galaxy j7 pro office 365 personal 1tb,motorola moto c plus tela 5 '' 8gb camera 8mp microsoft office 365 personal
iphone 5s 32gb 100 funcionando 3g 4g b,usado iphone 5s 32gb
iphone 7 32gb original apple vitrine nf,carregador original apple
j810m galaxy j8 64gb,samsung j8 j810m tela 6 dual sim 64gb
lancamento xiaomi mi a2 64gb 4g ram global lacrado,xiaomi mi 8 lite versao global--64gb
lancamento xiaomi mi a2 64gb 4g ram global promocao,xiaomi mi 8 lite versao global--64gb
lg k10 2017 m250dsf dual 32gb,lg k10 2017 m250dsf dual 32gb/2gb /
lg k10 4g original lacrado octacore16gb tela5.3 nota,lg k10 4g
lg k10 dual 4g tela 5.3 2gb ram 2 cameras android 7,lg k10 2017 32gb 2gb ram dual chip cam 13mp 4g
"lg k10 novo 2017 4g m250ds 32gb tela 5,3 original","lg k10 novo 2017 4g m250ds 16gb tela 5,3"
"lg k10 novo 2017 4g m250ds 32gb tiio tela 5,3","lg k10 novo 2017 4g m250ds 16gb tela 5,3"
lg k10 power lgm320tv dual chip 4g wi-fi,"lg k10 power dual chip android 7.0 tela 5,5 '' octacore 32gb 4g wi-fi camera 13mp tiio"
lg k10 power m320tv 32gb tela 5.5 '' 4g,lg k10 power m320tv 32gb
lg k10 power novo m320tv camera 13mp 32gb,lg k10 power m320tv 32gb
lg k4 8gb x230ds 2017 dual sim 8mpx 5 novo original,lg k4 x230ds 8gb
lg k4 novo 2017 dual sim 8gb tela 5.0 8mp/4mp,lg k4 2017 x230f 8gb tela 5.0 '' 8mp/4mp 6.0 cinz
moto c plus 16gb 4g original,motorola moto g6 plus original 64gb
moto c plus dual chip 16gb,motorola moto e5 plus dual chip 16gb
moto g5 xt1671 novo 32gb orig+brinde+nota fiscal,lg g5 32gb
moto g5s plus 32gb 3gb ram platin+brinde+nota fiscal,motorola moto g5s plus 32gb dual chip 4g tela 5.5
moto g6 play dual chip 5.7 32gb 4g 13mp,"moto g6 play motorola dual tela 5,7 '' 32gb 13mp"
motorola c plus xt1723 dual 16gb original nf,motorola moto g6 plus original 64gb
motorola g5 32gb android tela 5 camera 13mp fone,lg g5 android 6.0 tela 5.3 '' 32gb 4g camera 16mp
motorola moto c 16g plus quad core dual sim tela 5,motorola moto c 16g quad core dual sim 4gtela 5
motorola moto c plus 16g tela 5 frete gratis \o/,motorola moto e4 plus biometria tela 5.5 16g 4glte
motorola moto c plus dual sim 16gb tela 5 2gb ram,motorola moto e5 plus xt1924 16gb 2gb ram
motorola moto c plus xt-1723 5.0 polegadas nf,motorola moto g4 plus xt-1642 5.5 polegadas dual-sim 16gb 4g
motorola moto c plus xt1724 dual 16gb tela 5 fone,motorola moto c plus dual android 7.0 tela 5
motorola moto c plus xt1724 dual sim 16gb tela 5,motorola moto c plus dual android 7.0 tela 5
motorola moto g5 xt1671 32gb dual original,motorola moto g g5 s plus 32gb original
motorola moto g5 xt1677 dual sim 16gb android 7.0,motorola moto g5 xt1677 dual chip android 7.0 tela 5.0 16gb 4g camera 13mp
motorola moto g5s plus 32gb/4gb original grafite,motorola moto g g5 s plus 32gb original
motorola moto g5s plus xt1805 32gb brinde notafiscal,moto g5s plus xt1805 motorola dual sim 32gb tela 5.5 '' dupla camera traseira 13mp/8mp- grafite
motorola moto g6 play 32gb 4g android 8.0,motorola moto g6 play 32gb dual 4g
motorola moto g6 play 32gb 4g android 8.0,motorola moto g6 play 32gb dual 4g
motorola moto g6 play 32gb android 8 4g+microsd 16gb,motorola moto g6 play 32gb dual 4g
motorola moto g6 play 32 gb,"moto g5 s plus dual,4g 5.5 32 gb"
motorola moto g6 play 32 gb xt1922,moto g6 play motorola xt1922-5 32gb
motorola moto g6 play 32 gb xt1922,moto g6 play motorola xt1922-5 32gb
motorola moto g6 play 32 gb xt1922,moto g6 play motorola xt1922-5 32gb
motorola moto g6 play android 8.0 32gb 4g,motorola moto g6 play 32gb dual 4g
motorola moto g6 play android 8.0 32gb 4g,motorola moto g6 play 32gb dual 4g
motorola moto g6 play xt1922 4g 32gb dual android 8,moto g6 play motorola xt1922-5 32gb
motorola moto g6 play xt1922 4g 32gb dual android 8,moto g6 play motorola xt1922-5 32gb
motorola moto g6 plus 64gb 4gb octacore 2.2ghz,motorola moto g6 dual tela 5.7 4gb+64gb
motorola moto g6 plus 64gb 4gb ram tela 5.9,motorola moto g6 dual tela 5.7 4gb+64gb
motorola moto g6 plus dual 64gb 4gbram tv xt1926-8,motorola moto g6 plus xt1926-9 64gb dual-sim
motorola moto z3 play 64gb,usado motorola moto z3 play 64gb
new 100 original motorola moto z2 play 64gb xt1710,usado moto z2 play motorola xt1710 dual 64gb
"novo xiaomi mi a2 64gb 4g 5,99 ram global",xiaomi mi 8 lite versao global--64gb
novo original mi5 plus xiaomi mi 3gb 32gb lacrado,apple iphone 6 32gb novo lacrado
novo xiaomi mi note 5 64gb pro 4gb ram global 4g,xiaomi mi note 6 pro 6.26 pol ram 4gb 64gb 4g dual chip camera dupla 12/5mp
original xiaomi mi note 5 64gb pro 4gb ram global,xiaomi mi note 6 pro 6.26 pol ram 4gb 64gb 4g dual chip camera dupla 12/5mp
positivo twist mini tela 4.0 8mp 8gb 3g android 6.0,positivo twist mini s430 tela 4 '' 8gb 8mp
mi xiaomi 5a 4g 2gb ram 16gb tela 5,moto g 5a geracao 32gb
mi xiaomi 5a 4g 2gb ram 16gb tela 5.0 original,moto g 5a geracao 32gb
mi xiaomi 5a 4g 2gb ram 16gb tela 5.0 p. entrega,moto g 5a geracao 32gb
samsung a530f galaxy a8 duos dual tela 5.6 '' 64gb,galaxy a8 duos 2018 a530f/ds 64gb
samsung galaxy a8 2018 sm-a530f 64gb,galaxy a8 duos 2018 a530f/ds 64gb
samsung galaxy a8 plus 2018 sm-a730f 64gb,galaxy a8+ duos 2018 a730f/ds 64gb
samsung galaxy a8 plus 2018 sm-a730f 64gb,galaxy a8+ duos 2018 a730f/ds 64gb
samsung galaxy a8 plus 6 64gb 4g 16mp,samsung galaxy a8 64gb usado
samsung galaxy j2 prime 16gb dual sim cam 8mp wifi,samsung galaxy j2 prime dual 6 16gb 5 '' 8mp
samsung galaxy j2 pro android 7.1 tela 5 16gb,usado samsung galaxy j2 pro
samsung galaxy j2 pro android 7.1 16gb,usado samsung galaxy j2 pro
samsung galaxy j5 prime 32gb biometria 13mp +brindes,samsung galaxy j5 prime 5 '' 4g android 6.0.1 13mp 32gb
samsung galaxy j5 prime 32gb biometria 13mp +brindes,samsung galaxy j5 prime 5 '' 4g android 6.0.1 13mp 32gb
samsung galaxy j5 prime g570m tela 5 32gb 13mp,galaxy j5 prime samsung g570m/ds duos 32gb
samsung galaxy j5 pro sm-j530g dual chip,galaxy j5 pro samsung j530g/ds 32gb
samsung galaxy j5 pro sm-j530g dual chip,galaxy j5 pro samsung j530g/ds 32gb
samsung galaxy j5 pro sm-j530g dual chip,galaxy j5 pro samsung j530g/ds 32gb
samsung galaxy j5 pro sm-j530g/ds 32gb,galaxy j5 pro samsung j530g/ds 32gb
samsung galaxy j7 neo tela 5.5 flash frontal,samsung galaxy j7 neo 5.5 android 16gb 2gb ram camera 13mp 5mp frontal flash led dual chip
samsung galaxy j7 neo tela 5.5 tv digital,samsung galaxy j7 neo dual chip android 7.0 tela 5.5 '' 16gb 4g camera 13mp tv
samsung galaxy j7 prime 2 32gb brinde,samsung galaxy j7 prime
samsung galaxy j7 prime 2 32gb tv digital,samsung galaxy j7 prime
samsung galaxy j7 prime 2 32gb tv digital,samsung galaxy j7 prime
samsung galaxy j7 prime 2 32gb tv digital,samsung galaxy j7 prime
samsung galaxy j7 prime 2 32gb tv digital,samsung galaxy j7 prime
samsung galaxy j7 prime 2 32gb tv digital,samsung galaxy j7 prime
samsung galaxy j7 prime 2 32gb tv digital,samsung galaxy j7 prime
samsung galaxy j7 prime 2 32gb tv digital nf,samsung galaxy j7 prime
samsung galaxy j7 pro 64gb 5.5 64gb 4g 13mp,samsung galaxy j7 pro 7.0 tela 5.5 '' 64gb 4g wi-fi camera 13mp vivo
samsung galaxy s4 mini 8gb 3g/lte android 4.4,usado galaxy s4 mini duos 8gb
samsung galaxy s9 plus 128gb tela infinita 6.2,samsung galaxy s9 plus 128gb usado
samsung j400m galaxy j4 32 gb,samsung galaxy j4 sm-j400m dual 16 gb 16 gb
samsung j400m galaxy j4 32 gb,samsung galaxy j4 sm-j400m dual 16 gb 16 gb
samsung j400m galaxy j4 32 gb,samsung galaxy j4 sm-j400m dual 16 gb 16 gb
samsung j400m galaxy j4 32 gb,samsung galaxy j4 sm-j400m dual 16 gb 16 gb
samsung j400m galaxy j4 32 gb,samsung galaxy j4 sm-j400m dual 16 gb 16 gb
samsung j400m galaxy j4 32 gb,samsung galaxy j4 sm-j400m dual 16 gb 16 gb
samsung j400m galaxy j4 16 gb,samsung galaxy j4 sm-j400m dual 16 gb 16 gb
samsung j400m galaxy j4 32 gb,samsung galaxy j4 sm-j400m dual 16 gb 16 gb
samsung j400m galaxy j4 32 gb,samsung galaxy j4 sm-j400m dual 16 gb 16 gb
samsung j400m galaxy j4 32 gb,samsung galaxy j4 sm-j400m dual 16 gb 16 gb
samsung j400m galaxy j4 32 gb,samsung galaxy j4 sm-j400m dual 16 gb 16 gb
samsung j400m galaxy j4 a 32 gb,samsung galaxy j4 sm-j400m dual 16 gb 16 gb
samsung j400m galaxy j4 a 32 gb,samsung galaxy j4 sm-j400m dual 16 gb 16 gb
samsung j8 64gb tela 6 '' 4g,samsung galaxy j8 dual chip 4g 64gb tela 6
samsung j8 64gb a tela 6 '' 4g,samsung galaxy j8 dual chip 4g 64gb tela 6
up 2chip quad cam mp3/4 fm /,new up multilaser dual chip camera mp3 radio fm tooth lanterna p9033
xiaomi mi 2 a2 64gb 4g ram global lancamento,xiaomi mi 8 lite versao global--64gb
xiaomi mi 8 64gb 6gb ram global snapdragon 845 top,mi 9 64gb dual sim versao global 6gb ram
xiaomi mi 8 64gb 6gb ram snapdragon 845 global,mi 9 64gb dual sim versao global 6gb ram
xiaomi mi a1 4gb ram 64gb 2 chip,xiaomi mi 8 lite 6.26 pol ram 4gb 64gb 4g dual chip camera dupla 12/5mp
xiaomi mi a1 tela 5.5 4gb ram 64gb 2 chips android,xiaomi mi note 7 tela infinita 6.3 pol ram 4gb 64gb camera dupla 48/5mp
xiaomi mi a2 64gb 4g ram c\nota novo lacrado,apple iphone 6 32gb novo lacrado
xiaomi mi a2 64gb 4g ram c\nota novo lacrado,apple iphone 6 32gb novo lacrado
xiaomi mi a2 lite 64gb 4g ram lacrado envio 24hs,xiaomi mi 8 lite versao global--64gb
xiaomi mi a2 lite global 3gb ram 32gb original,xiaomi mi 8 lite versao global
xiaomi pocophone f1 64gb 6gb c\nota global lacrado,xiaomi pocophone f1 6.18 pol ram 6gb 128gb 4g dual chip camera dupla 12/5 mp
"xiaomi mi 5 tela 5,7 global 3gb ram 32gb interno",xiaomi mi 8 lite versao global
xiaomi mi 6 32gb 3gb 12mp 5.45 '' original global,xiaomi mi 8 lite versao global
xiaomi mi 6 32gb 3gb ram dual cam,xiaomi mi 7 tela infinita 6.26 pol ram 3gb 32gb camera dupla 12/2mp
xiaomi mi 6 32gb 3gb ram dual camera novo lacrado,apple iphone 6 32gb novo lacrado
"xiaomi mi 6 64gb 4g 4gb ram tela 5,45 original",xiaomi mi 8 lite 6.26 pol ram 4gb 64gb 4g dual chip camera dupla 12/5mp
xiaomi mi mi a1 4g dual 64gb 4gb ram 5.5 lacrado,xiaomi mi 8 lite 6.26 pol ram 4gb 64gb 4g dual chip camera dupla 12/5mp
xiaomi mi note 4 64gb 5.5,xiaomi mi note 7 tela infinita 6.3 pol ram 4gb 64gb camera dupla 48/5mp
xiaomi mi note 4x 64gb 4gb ram original lacrado,xiaomi mi note 7 tela infinita 6.3 pol ram 4gb 64gb camera dupla 48/5mp
xiaomi mi note 5 32gb 3gb c/ 3 brindes,xiaomi mi 7 tela infinita 6.26 pol ram 3gb 32gb camera dupla 12/2mp
xiaomi mi note 5 32gb 3gb global,xiaomi mi 8 lite versao global
xiaomi mi note 5 32gb 3gb global lacrado,xiaomi mi 8 lite versao global
xiaomi mi note 5 32gb 3gb global lacrado,xiaomi mi 8 lite versao global
xiaomi mi note 5 32gb global lacrado dual s/juros,xiaomi mi 8 lite versao global
xiaomi mi note 5 64gb 4gb 5.99pol,xiaomi mi note 7 tela infinita 6.3 pol ram 4gb 64gb camera dupla 48/5mp
xiaomi mi note 5 64gb 4gb ram 5.9 nfe novo 12x sj,xiaomi mi note 7 tela infinita 6.3 pol ram 4gb 64gb camera dupla 48/5mp
xiaomi mi note 5 64gb 4gb ram 5.9p 12mp nfe novo,xiaomi mi note 7 tela infinita 6.3 pol ram 4gb 64gb camera dupla 48/5mp
xiaomi mi note 5 64gb global lacrado dual chip,xiaomi mi 8 lite versao global--64gb
xiaomi mi note 5 64gb global lacrado dual s/juros,xiaomi mi 8 lite versao global--64gb
xiaomi mi note 5 pro 64gb 4gb global 12x juro,xiaomi mi 8 lite versao global--64gb
xiaomi mi s2 64gb 4gb ram 4g lacrado *global,xiaomi mi 8 lite versao global--64gb
xiaomin mi note 5 32gb 3gb xiaomi global brinde,xiaomi mi 8 lite versao global
xiaomin mi note 5 64gb 4g ram pronta entrega,xiaomi mi note 6 pro 6.26 pol ram 4gb 64gb 4g dual chip camera dupla 12/5mp
galaxy s4 mini 8gb original samsung novo vitrine,usado galaxy s4 mini duos 8gb
galaxy s5 mini duos g800h,usado galaxy s5 mini duos samsung 16gb
galaxy s7 edge 32gb original samsung g935f vitrine,galaxy s7 edge g935f samsung 32gb
galaxy s8 plus 64gb duos dual chip samsung novo vitrine,samsung galaxy s8 plus dual 64gb 6.2 ''
galaxy s9 plus 128 gb n fiscal r 2750 1x mp,iphone 6s plus 128 gb
galaxy s9+ plus tela 6.2 lacrado anatel,asus zenfone 2 lacrado anatel 64gb 4gb ram
galaxy tab 9.6 wi-fi,tablet samsung tab 10.1 '' full hd 16gb wifi 8mp android 6
interface intelbras quad band central telefonica itc 4100,telefone fio ts 2511 digital intelbras
iphone 5s 32gb novo lacrado garantia vendedor 6 meses,apple iphone 6s 16gb novo lacrado 2 anos garantia
"iphone 6 16gb apple tela 4,7 garantia novo original apple",apple iphone 6s 16gb novo lacrado 2 anos garantia
"iphone 6 16gb apple tela 4,7 original apple tooth",iphone 6 apple 16gb
iphone 6 64gb apple original 4g 4 7 rfb desb vista r 1.499,carregador original apple
iphone 6 64gb novo lacrado garantia 03 meses vendedor,apple iphone 6s 16gb novo lacrado 2 anos garantia
iphone 6 64gb novo lacrado garantia 6 meses vendedor,apple iphone 6s 16gb novo lacrado 2 anos garantia
iphone 6 plus 16gb novo lacrado original apple 6 mes garanti,apple iphone 6 32gb novo lacrado
iphone 6 plus 64gb lacrado cabo lighting,apple iphone 6 32gb novo lacrado
iphone 6 plus 64gb novo lacrado origina apple garantia 6 mes,apple iphone 6s 16gb novo lacrado 2 anos garantia
iphone 6 plus 64gb tela 5 5 12mp 4k touchid apple rfb desbl,iphone 6 plus 64gb apple
iphone 7 128gb 4g 4 7 12mp 4k touchid apple rfb,iphone 6 apple 128gb
iphone 7 plus 256gb lacrado nf garantia apple 2 brindes,apple iphone 6s 16gb lacrado garantia 2 anos
iphone 8 64gb lacrado nf,apple iphone 6 32gb novo lacrado
iphone 8 64gb novo lacrado anatel garantia apple 1 ano,apple iphone 6s 16gb novo lacrado 2 anos garantia
"iphone 8 64gb lacrado nf anatel 3388,88 avista",asus zenfone 2 lacrado anatel 64gb 4gb ram
iphone 8 apple plus 256gb 01 ano garantia envio imediato,apple iphone 6 plus 128gb- envio imediato
"iphone 8 apple plus 256gb tela retina hd 5,5 '' ios 11 dupla camera traseira resistente wi-fi 4g lte nfc -",iphone 8 plus 256gb tela 5.5 '' ios 11 4g wi-fi camera 12mp apple
"iphone 8 apple plus 256gb tela retina hd 5,5 '' ios 11 dupla camera traseira resistente wi-fi 4g lte nfc",iphone 8 plus 256gb tela 5.5 '' ios 11 4g wi-fi camera 12mp apple
"iphone 8 apple plus 256gb tela retina hd 5,5 '' ios 11 dupla camera traseira resistente wi-fi 4g lte nfc prateado",iphone 8 plus 256gb tela 5.5 '' ios 11 4g wi-fi camera 12mp apple
iphone 8 apple plus 64gb,iphone 6 plus 64gb apple
"iphone 8 apple plus 64gb tela retina hd 5,5 '' ios 11 dupla camera traseira resistente wi-fi 4g lte nfc -",iphone 8 plus 64gb tela 5.5 '' ios 11 4g wi-fi camera 12mp apple
"iphone 8 apple plus 64gb tela retina hd 5,5 '' ios 11 dupla camera traseira resistente wi-fi 4g lte nfc",iphone 8 plus 64gb tela 5.5 '' ios 11 4g wi-fi camera 12mp apple
"iphone 8 apple plus 64gb tela retina hd 5,5 '' ios 11 dupla camera traseira resistente wi-fi 4g lte nfc prateado",iphone 8 plus 64gb tela 5.5 '' ios 11 4g wi-fi camera 12mp apple
iphone 8 plus 64gb 4g 1 ano garantia apple nota fiscal,iphone 6 plus 64gb apple
iphone 8 plus 64gb nota fiscal lacrado,apple iphone 6 32gb novo lacrado
iphone 8 plus 64gb garantia 1 ano apple novo lacrado,apple iphone 6s 16gb novo lacrado 2 anos garantia
"iphone 8 plus 64gb nota fiscal lacrado avista 3888,88",apple iphone 6 32gb novo lacrado
"iphone 8 plus 64gb nota fiscal lacrado avista 3888,88",apple iphone 6 32gb novo lacrado
iphone 8 plus 64gb novo lacrado origina garantia 1 ano apple,apple iphone 6s 16gb novo lacrado 2 anos garantia
iphone 8 plus 64gb original lacrado homologado ael,motorola moto g6 plus original 64gb
"iphone 8 plus apple 64gb retina hd 5,5 ios 11 4g",iphone 8 plus 64gb tela 5.5 '' ios 11 4g wi-fi camera 12mp apple
iphone 8 plus apple special edition 256gb tela retina hd 5.5 '' ios11 camera dupla 12mp,iphone 8 plus 256gb special edition tela 5.5 '' ios 11 4g camera 12mp apple
iphone 8 plus apple special edition 64gb tela retina hd 5.5 '' ios11 camera dupla 12mp,iphone 8 plus 256gb special edition tela 5.5 '' ios 11 4g camera 12mp apple
iphone apple 8 64gb plus debloq s/juros leia anuncio,iphone 6 plus 64gb apple
iphone apple x 64gb novo lacrado 5.8 garantia 01 ano,apple iphone 6s 16gb novo lacrado 2 anos garantia
iphone x 64gb apple lacrado,apple iphone 6 32gb novo lacrado
iphone x 64gb novo lacrado anatel nf garantia apple,apple iphone 6s 16gb novo lacrado 2 anos garantia
iphone x 64gb novo lacrado cpo original garantia 1 ano apple,apple iphone 6s 16gb novo lacrado 2 anos garantia
iphone x 64gb envio imediato 1 ano garantia,iphone 6s 64gb envio imediato
kit capapelicula samsung galaxy duos s6102,samsung galaxy gran prime duos chip android 4.4 kit kat tela 5 '' 8gb 3g camera 8mp
kit capapelicula samsung galaxy y/y tv s5360,samsung galaxy y barbie gt-s5360 android 2.3 wi-fi 3g
kit lentes 3 1 fisheye macro wide,kit gamer macro multilaser mouse mo207 teclado led tc199
lancamento cat s61 tela 5.2 64gb 4g dual sim,cat s31
lancamento xiaomi mi s2 32gb dual sim rom global oreo 8.1,xiaomi mi 8 lite versao global
lancamento xiaomi mi s2 64gb dual sim rom global oreo 8.1,xiaomi mi 8 lite versao global--64gb
lg k10 novo 2017 lgm250ds 32gb lacrado,apple iphone 6 32gb novo lacrado
mega promocao samsung galaxy s6 edge g925 32gb -vitrine,samsung galaxy s6 edge g925 32gb camera 16mp tela 5.1
mirror cast multilaser au906 espelhamento tela ios android,mirror cast multilaser au906 espelhamento tela ios android
novo xiaomi mi note 5 64gb 4gb ram versao global,xiaomi mi 8 lite versao global--64gb
promocao moto e4 plus 5.5 16gb biometria,motorola moto e4 plus 3+16gb
